{
  "version": "0.8.0",
  "audit_id": "TAE-COE-AUDIT-V0.8.0",
  "audit_date": "2026-08-10",
  "scope": "Twenty material claims declared in TAE-COE-V0.8.0, including the reader manuscript, Figure 6, Table A3, and the author-screening gate. Independent validity, final author screening, and authenticated database coverage remain outside the completed evidence base.",
  "status": "PASS_WITH_EXCEPTIONS",
  "checks": [
    {
      "check_id": "COE-I1",
      "name": "score_verification",
      "status": "pass",
      "tested": 30,
      "passed": 30,
      "failed": 0,
      "indeterminate": 0,
      "findings": []
    },
    {
      "check_id": "COE-I2",
      "name": "specification_violation",
      "status": "pass",
      "tested": 20,
      "passed": 20,
      "failed": 0,
      "indeterminate": 0,
      "findings": []
    },
    {
      "check_id": "COE-I3",
      "name": "reference_verification",
      "status": "pass",
      "tested": 20,
      "passed": 20,
      "failed": 0,
      "indeterminate": 0,
      "findings": []
    },
    {
      "check_id": "COE-I4",
      "name": "method_code_alignment",
      "status": "pass",
      "tested": 5,
      "passed": 5,
      "failed": 0,
      "indeterminate": 0,
      "findings": []
    },
    {
      "check_id": "COE-I5",
      "name": "evidence_fitness_and_dependency_closure",
      "status": "pass_with_exceptions",
      "tested": 20,
      "passed": 18,
      "failed": 2,
      "indeterminate": 0,
      "findings": [
        "TAE-C23: evidence fitness is fail",
        "PAPER-C26: evidence fitness is fail"
      ]
    }
  ],
  "negative_controls": [
    {
      "control_id": "COE-NC-01",
      "expected_check": "score_verification",
      "detected": true,
      "observed_check": "score_verification",
      "message": "PAPER-C03/C03-OKO-AUTHORITY: expected 'unsupported', observed 'partially_supported'"
    },
    {
      "control_id": "COE-NC-02",
      "expected_check": "reference_verification",
      "detected": true,
      "observed_check": "reference_verification",
      "message": "PAPER-C05/C05-AUTHORITY: missing file"
    },
    {
      "control_id": "COE-NC-03",
      "expected_check": "reference_verification",
      "detected": true,
      "observed_check": "reference_verification",
      "message": "PAPER-C06: human support review pending"
    },
    {
      "control_id": "COE-NC-04",
      "expected_check": "evidence_fitness_and_dependency_closure",
      "detected": true,
      "observed_check": "evidence_fitness_and_dependency_closure",
      "message": "PAPER-C03: evidence fitness is fail"
    },
    {
      "control_id": "COE-NC-05",
      "expected_check": "method_code_alignment",
      "detected": true,
      "observed_check": "method_code_alignment",
      "message": "PAPER-C08: method or implementation marker does not resolve"
    },
    {
      "control_id": "COE-NC-06",
      "expected_check": "evidence_fitness_and_dependency_closure",
      "detected": true,
      "observed_check": "evidence_fitness_and_dependency_closure",
      "message": "PAPER-C09: unresolved dependencies PAPER-C99"
    },
    {
      "control_id": "COE-NC-07",
      "expected_check": "reference_verification",
      "detected": true,
      "observed_check": "reference_verification",
      "message": "TAE-C21/C21-PROTOCOL: integrity failure"
    },
    {
      "control_id": "COE-NC-08",
      "expected_check": "score_verification",
      "detected": true,
      "observed_check": "score_verification",
      "message": "PAPER-C03/C03-OKO-AUTHORITY: categorical state mislabelled as multi_run_mean"
    },
    {
      "control_id": "COE-NC-09",
      "expected_check": "specification_violation",
      "detected": true,
      "observed_check": "specification_violation",
      "message": "TAE-C21: guarantees lacks a scope justification"
    },
    {
      "control_id": "COE-NC-10",
      "expected_check": "score_verification",
      "detected": true,
      "observed_check": "score_verification",
      "message": "PAPER-C23/C17-OKO-PARTIAL: expected '5', observed '6'"
    },
    {
      "control_id": "COE-NC-11",
      "expected_check": "reference_verification",
      "detected": true,
      "observed_check": "reference_verification",
      "message": "PAPER-C22/C16-PRESSURE-TEST: missing file"
    },
    {
      "control_id": "COE-NC-12",
      "expected_check": "reference_verification",
      "detected": true,
      "observed_check": "reference_verification",
      "message": "PAPER-C24: human support review pending"
    },
    {
      "control_id": "COE-NC-13",
      "expected_check": "evidence_fitness_and_dependency_closure",
      "detected": true,
      "observed_check": "evidence_fitness_and_dependency_closure",
      "message": "TAE-C23: evidence fitness is fail"
    },
    {
      "control_id": "COE-NC-14",
      "expected_check": "method_code_alignment",
      "detected": true,
      "observed_check": "method_code_alignment",
      "message": "PAPER-C25: method or implementation marker does not resolve"
    }
  ],
  "exceptions": [
    "COE-EX-03",
    "COE-EX-04",
    "COE-EX-05"
  ],
  "claim_results": [
    {
      "claim_id": "PAPER-C02",
      "traceability": "pass",
      "integrity": "pass",
      "support": "pass",
      "evidence_fitness": "pass",
      "dependency_closure": "pass",
      "conclusion_eligible": true
    },
    {
      "claim_id": "PAPER-C03",
      "traceability": "pass",
      "integrity": "pass",
      "support": "pass",
      "evidence_fitness": "pass",
      "dependency_closure": "pass",
      "conclusion_eligible": true
    },
    {
      "claim_id": "PAPER-C04",
      "traceability": "pass",
      "integrity": "pass",
      "support": "pass",
      "evidence_fitness": "pass",
      "dependency_closure": "pass",
      "conclusion_eligible": true
    },
    {
      "claim_id": "PAPER-C05",
      "traceability": "pass",
      "integrity": "pass",
      "support": "pass",
      "evidence_fitness": "pass",
      "dependency_closure": "pass",
      "conclusion_eligible": true
    },
    {
      "claim_id": "PAPER-C06",
      "traceability": "pass",
      "integrity": "pass",
      "support": "pass",
      "evidence_fitness": "pass",
      "dependency_closure": "pass",
      "conclusion_eligible": true
    },
    {
      "claim_id": "PAPER-C07",
      "traceability": "pass",
      "integrity": "pass",
      "support": "pass",
      "evidence_fitness": "pass",
      "dependency_closure": "pass",
      "conclusion_eligible": true
    },
    {
      "claim_id": "PAPER-C08",
      "traceability": "pass",
      "integrity": "pass",
      "support": "pass",
      "evidence_fitness": "pass",
      "dependency_closure": "pass",
      "conclusion_eligible": true
    },
    {
      "claim_id": "PAPER-C09",
      "traceability": "pass",
      "integrity": "pass",
      "support": "pass",
      "evidence_fitness": "pass",
      "dependency_closure": "pass",
      "conclusion_eligible": true
    },
    {
      "claim_id": "PAPER-C11",
      "traceability": "pass",
      "integrity": "pass",
      "support": "pass",
      "evidence_fitness": "pass",
      "dependency_closure": "pass",
      "conclusion_eligible": true
    },
    {
      "claim_id": "PAPER-C14",
      "traceability": "pass",
      "integrity": "pass",
      "support": "pass",
      "evidence_fitness": "pass",
      "dependency_closure": "pass",
      "conclusion_eligible": true
    },
    {
      "claim_id": "PAPER-C15",
      "traceability": "pass",
      "integrity": "pass",
      "support": "pass",
      "evidence_fitness": "pass",
      "dependency_closure": "pass",
      "conclusion_eligible": true
    },
    {
      "claim_id": "TAE-C21",
      "traceability": "pass",
      "integrity": "pass",
      "support": "pass",
      "evidence_fitness": "pass",
      "dependency_closure": "pass",
      "conclusion_eligible": true
    },
    {
      "claim_id": "TAE-C23",
      "traceability": "pass",
      "integrity": "pass",
      "support": "pass",
      "evidence_fitness": "fail",
      "dependency_closure": "outside_scope",
      "conclusion_eligible": false
    },
    {
      "claim_id": "TAE-C24",
      "traceability": "pass",
      "integrity": "pass",
      "support": "pass",
      "evidence_fitness": "pass",
      "dependency_closure": "pass",
      "conclusion_eligible": true
    },
    {
      "claim_id": "TAE-C25",
      "traceability": "pass",
      "integrity": "pass",
      "support": "pass",
      "evidence_fitness": "pass",
      "dependency_closure": "pass",
      "conclusion_eligible": true
    },
    {
      "claim_id": "PAPER-C22",
      "traceability": "pass",
      "integrity": "pass",
      "support": "pass",
      "evidence_fitness": "pass",
      "dependency_closure": "pass",
      "conclusion_eligible": true
    },
    {
      "claim_id": "PAPER-C23",
      "traceability": "pass",
      "integrity": "pass",
      "support": "pass",
      "evidence_fitness": "pass",
      "dependency_closure": "pass",
      "conclusion_eligible": true
    },
    {
      "claim_id": "PAPER-C24",
      "traceability": "pass",
      "integrity": "pass",
      "support": "pass",
      "evidence_fitness": "pass",
      "dependency_closure": "pass",
      "conclusion_eligible": true
    },
    {
      "claim_id": "PAPER-C25",
      "traceability": "pass",
      "integrity": "pass",
      "support": "pass",
      "evidence_fitness": "pass",
      "dependency_closure": "pass",
      "conclusion_eligible": true
    },
    {
      "claim_id": "PAPER-C26",
      "traceability": "pass",
      "integrity": "pass",
      "support": "pass",
      "evidence_fitness": "fail",
      "dependency_closure": "pass",
      "conclusion_eligible": false
    }
  ]
}
